{
  "uid": "53ad44a7-66e9-4374-acf2-d02d8e233820",
  "name": "entity1 to entity2",
  "job": "2c43088b-0ae3-411f-bb0f-f33e40b21f9c",
  "dag": "24231a7a-acd0-4f5d-86a6-77fa61028c1a",
  "task": "dddf8c61-24f3-420b-8be8-8edcc834c7a4",
  "version": "1.0.0",
  "sourceTargetEntityLinks": [ { "from" : "d042b292-7c81-408a-ad43-49833ca804c1", "to": "ed2359d8-9bc8-4fc8-bc6e-d4a2385efcc0"}]
}
